{
  "schema_version": 1,
  "profile": "rust",
  "status": "pending",
  "versions": {},
  "artifacts": [],
  "distribution_packages": {
    "ubuntu": [
      "build-essential",
      "clang",
      "cmake",
      "ninja-build",
      "pkg-config",
      "libssl-dev"
    ],
    "almalinux": [
      "gcc",
      "gcc-c++",
      "clang",
      "cmake",
      "ninja-build",
      "pkgconf-pkg-config",
      "openssl-devel"
    ]
  }
}
