{
  "schema_version": 1,
  "profile": "node",
  "status": "locked",
  "versions": {
    "node": "22.22.1",
    "npm": "10.9.4",
    "corepack": "0.34.6"
  },
  "artifacts": [
    {
      "name": "node",
      "architecture": "amd64",
      "url": "https://nodejs.org/dist/v22.22.1/node-v22.22.1-linux-x64.tar.xz",
      "sha256": "9a6bc82f9b491279147219f6a18add1e18424dce90d41d2a5fcd69d4924ba3aa"
    },
    {
      "name": "node",
      "architecture": "arm64",
      "url": "https://nodejs.org/dist/v22.22.1/node-v22.22.1-linux-arm64.tar.xz",
      "sha256": "0f3550d58d45e5d3cf7103d9e3f69937f09fe82fb5dd474c66a5d816fa58c9ee"
    }
  ],
  "distribution_packages": {
    "ubuntu": [
      "build-essential=12.12ubuntu2.26.04.2",
      "make=4.4.1-3",
      "python3=3.14.3-0ubuntu2"
    ],
    "almalinux": ["gcc", "gcc-c++", "make", "python3"]
  }
}
