{
  "schema_version": 1,
  "profile": "python",
  "status": "locked",
  "versions": {
    "python": "3.14.4",
    "uv": "0.10.8"
  },
  "artifacts": [
    {
      "name": "python-source",
      "architecture": "amd64",
      "url": "https://www.python.org/ftp/python/3.14.4/Python-3.14.4.tar.xz",
      "sha256": "d923c51303e38e249136fc1bdf3568d56ecb03214efdef48516176d3d7faaef8"
    },
    {
      "name": "python-source",
      "architecture": "arm64",
      "url": "https://www.python.org/ftp/python/3.14.4/Python-3.14.4.tar.xz",
      "sha256": "d923c51303e38e249136fc1bdf3568d56ecb03214efdef48516176d3d7faaef8"
    },
    {
      "name": "uv",
      "architecture": "amd64",
      "url": "https://github.com/astral-sh/uv/releases/download/0.10.8/uv-x86_64-unknown-linux-gnu.tar.gz",
      "sha256": "f0c566b55683395a62fefb9261a060fa09824914b5682c3b9629fa154762ae2f"
    },
    {
      "name": "uv",
      "architecture": "arm64",
      "url": "https://github.com/astral-sh/uv/releases/download/0.10.8/uv-aarch64-unknown-linux-gnu.tar.gz",
      "sha256": "661860e954f87dcd823251191866af3486484d1a9df60eed56f4586ed7559e3d"
    }
  ],
  "distribution_packages": {
    "ubuntu": [
      "build-essential=12.12ubuntu2.26.04.2",
      "pkg-config=2.5.1-4",
      "libssl-dev=3.5.5-1ubuntu3.2",
      "zlib1g-dev=1:1.3.dfsg+really1.3.1-1ubuntu3",
      "libbz2-dev=1.0.8-6build2",
      "libreadline-dev=8.3-4",
      "libsqlite3-dev=3.46.1-9ubuntu0.2",
      "libffi-dev=3.5.2-4",
      "liblzma-dev=5.8.3-1",
      "uuid-dev=2.41.3-3ubuntu2",
      "libgdbm-dev=1.26-1build1",
      "libncurses-dev=6.6+20251231-1"
    ],
    "almalinux": []
  }
}
